{
  "schema_version": 1,
  "run_id": "run-0b7c1d2e3f40",
  "baseline_run_id": "run-a1b2c3d4e5f6",
  "dataset": {
    "name": "example",
    "version": "1.0.0",
    "sha256": "f4b746153b7df0e11fe404ecce16b2a291e1fbdbc4dc04bc9244a5b310076866"
  },
  "served": {
    "query_config": "11d0a9e2c4f1",
    "embedding_fingerprint": "5e2d4c6b8a90",
    "chunking_fingerprint": null,
    "collection": "chunks_5e2d4c6b8a90"
  },
  "verdict": "passed",
  "checks": [
    {"name": "errors", "candidate": 0.0, "baseline": null, "tolerance": null, "passed": true},
    {"name": "search/leakage", "candidate": 0.0, "baseline": null, "tolerance": null, "passed": true},
    {"name": "answer/leakage", "candidate": 0.0, "baseline": null, "tolerance": null, "passed": true},
    {"name": "search/recall@5", "candidate": 1.0, "baseline": 0.99, "tolerance": 0.02, "passed": true}
  ],
  "gate": {
    "primary_metrics": ["search/recall@5"],
    "tolerance": 0.02,
    "zero_metrics": ["search/leakage", "answer/leakage"]
  },
  "decided_at": "2026-10-30T10:05:00+00:00"
}
